{"artifactVersion":1,"bindings":{"choiceSlots":["face","edge","vertex"],"choiceValues":[["idle","A","A'","A2","A2'","A3","B","B'","B2","B2'","B3","C","C'","C2","C2'","C3","D","D'","D2","D2'","D3"],["idle","A","A'","A2","A2'","A3","B","B'","B2","B2'","B3","C","C'","C2","C2'","C3","D","D'","D2","D2'","D3"],["idle","A","A'","A2","A2'","A3","B","B'","B2","B2'","B3","C","C'","C2","C2'","C3","D","D'","D2","D2'","D3"]],"events":["A.motion","A'.motion","A2.motion","A2'.motion","A3.motion","B.motion","B'.motion","B2.motion","B2'.motion","B3.motion","C.motion","C'.motion","C2.motion","C2'.motion","C3.motion","D.motion","D'.motion","D2.motion","D2'.motion","D3.motion"],"pieces":["face-00","face-01","face-02","face-03","edge-00","edge-01","edge-02","edge-03","edge-04","edge-05","edge-06","edge-07","edge-08","edge-09","edge-10","edge-11","vertex-00","vertex-01","vertex-02","vertex-03","vertex-04","vertex-05","vertex-06","vertex-07"],"placements":["face/0,0/1,0,0,1","face/0,0/0,-1,1,1","face/0,0/-1,-1,1,0","face/0,0/-1,0,0,-1","face/0,0/0,1,-1,-1","face/0,0/1,1,-1,0","face/6,0/1,0,0,1","face/6,0/0,-1,1,1","face/6,0/-1,-1,1,0","face/6,0/-1,0,0,-1","face/6,0/0,1,-1,-1","face/6,0/1,1,-1,0","face/0,6/1,0,0,1","face/0,6/0,-1,1,1","face/0,6/-1,-1,1,0","face/0,6/-1,0,0,-1","face/0,6/0,1,-1,-1","face/0,6/1,1,-1,0","face/6,6/1,0,0,1","face/6,6/0,-1,1,1","face/6,6/-1,-1,1,0","face/6,6/-1,0,0,-1","face/6,6/0,1,-1,-1","face/6,6/1,1,-1,0","edge/3,0/1,0,0,1","edge/3,0/-1,0,0,-1","edge/9,0/1,0,0,1","edge/9,0/-1,0,0,-1","edge/0,3/0,-1,1,1","edge/0,3/0,1,-1,-1","edge/3,3/-1,-1,1,0","edge/3,3/1,1,-1,0","edge/6,3/0,-1,1,1","edge/6,3/0,1,-1,-1","edge/9,3/-1,-1,1,0","edge/9,3/1,1,-1,0","edge/3,6/1,0,0,1","edge/3,6/-1,0,0,-1","edge/9,6/1,0,0,1","edge/9,6/-1,0,0,-1","edge/0,9/0,-1,1,1","edge/0,9/0,1,-1,-1","edge/3,9/-1,-1,1,0","edge/3,9/1,1,-1,0","edge/6,9/0,-1,1,1","edge/6,9/0,1,-1,-1","edge/9,9/-1,-1,1,0","edge/9,9/1,1,-1,0","vertex/2,2/1,0,0,1","vertex/2,2/-1,-1,1,0","vertex/2,2/0,1,-1,-1","vertex/8,2/1,0,0,1","vertex/8,2/-1,-1,1,0","vertex/8,2/0,1,-1,-1","vertex/2,8/1,0,0,1","vertex/2,8/-1,-1,1,0","vertex/2,8/0,1,-1,-1","vertex/8,8/1,0,0,1","vertex/8,8/-1,-1,1,0","vertex/8,8/0,1,-1,-1","vertex/4,4/0,-1,1,1","vertex/4,4/-1,0,0,-1","vertex/4,4/1,1,-1,0","vertex/10,4/0,-1,1,1","vertex/10,4/-1,0,0,-1","vertex/10,4/1,1,-1,0","vertex/4,10/0,-1,1,1","vertex/4,10/-1,0,0,-1","vertex/4,10/1,1,-1,0","vertex/10,10/0,-1,1,1","vertex/10,10/-1,0,0,-1","vertex/10,10/1,1,-1,0"],"puzzleId":"flat-hex-torus-v1","requests":[{"defaultProfile":0,"id":"A","profiles":[{"choices":[1,1,1],"id":"default","whenRoot":1}]},{"defaultProfile":0,"id":"A'","profiles":[{"choices":[2,2,2],"id":"default","whenRoot":1}]},{"defaultProfile":0,"id":"A2","profiles":[{"choices":[3,3,3],"id":"default","whenRoot":1}]},{"defaultProfile":0,"id":"A2'","profiles":[{"choices":[4,4,4],"id":"default","whenRoot":1}]},{"defaultProfile":0,"id":"A3","profiles":[{"choices":[5,5,5],"id":"default","whenRoot":1}]},{"defaultProfile":0,"id":"B","profiles":[{"choices":[6,6,6],"id":"default","whenRoot":1}]},{"defaultProfile":0,"id":"B'","profiles":[{"choices":[7,7,7],"id":"default","whenRoot":1}]},{"defaultProfile":0,"id":"B2","profiles":[{"choices":[8,8,8],"id":"default","whenRoot":1}]},{"defaultProfile":0,"id":"B2'","profiles":[{"choices":[9,9,9],"id":"default","whenRoot":1}]},{"defaultProfile":0,"id":"B3","profiles":[{"choices":[10,10,10],"id":"default","whenRoot":1}]},{"defaultProfile":0,"id":"C","profiles":[{"choices":[11,11,11],"id":"default","whenRoot":1}]},{"defaultProfile":0,"id":"C'","profiles":[{"choices":[12,12,12],"id":"default","whenRoot":1}]},{"defaultProfile":0,"id":"C2","profiles":[{"choices":[13,13,13],"id":"default","whenRoot":1}]},{"defaultProfile":0,"id":"C2'","profiles":[{"choices":[14,14,14],"id":"default","whenRoot":1}]},{"defaultProfile":0,"id":"C3","profiles":[{"choices":[15,15,15],"id":"default","whenRoot":1}]},{"defaultProfile":0,"id":"D","profiles":[{"choices":[16,16,16],"id":"default","whenRoot":1}]},{"defaultProfile":0,"id":"D'","profiles":[{"choices":[17,17,17],"id":"default","whenRoot":1}]},{"defaultProfile":0,"id":"D2","profiles":[{"choices":[18,18,18],"id":"default","whenRoot":1}]},{"defaultProfile":0,"id":"D2'","profiles":[{"choices":[19,19,19],"id":"default","whenRoot":1}]},{"defaultProfile":0,"id":"D3","profiles":[{"choices":[20,20,20],"id":"default","whenRoot":1}]}]},"executionDigest":"ea341cbfaed93635ac61974b47c6b9fbce8f7cf587395fcf07c404915a2c4d4f","kind":"twisty-abstract-artifact","program":{"actionRecords":[{"event":0,"map":0,"piece":0,"selectionRoot":301},{"event":0,"map":0,"piece":1,"selectionRoot":301},{"event":0,"map":0,"piece":2,"selectionRoot":301},{"event":0,"map":0,"piece":3,"selectionRoot":301},{"event":1,"map":1,"piece":0,"selectionRoot":302},{"event":1,"map":1,"piece":1,"selectionRoot":302},{"event":1,"map":1,"piece":2,"selectionRoot":302},{"event":1,"map":1,"piece":3,"selectionRoot":302},{"event":2,"map":2,"piece":0,"selectionRoot":303},{"event":2,"map":2,"piece":1,"selectionRoot":303},{"event":2,"map":2,"piece":2,"selectionRoot":303},{"event":2,"map":2,"piece":3,"selectionRoot":303},{"event":3,"map":3,"piece":0,"selectionRoot":304},{"event":3,"map":3,"piece":1,"selectionRoot":304},{"event":3,"map":3,"piece":2,"selectionRoot":304},{"event":3,"map":3,"piece":3,"selectionRoot":304},{"event":4,"map":4,"piece":0,"selectionRoot":305},{"event":4,"map":4,"piece":1,"selectionRoot":305},{"event":4,"map":4,"piece":2,"selectionRoot":305},{"event":4,"map":4,"piece":3,"selectionRoot":305},{"event":5,"map":5,"piece":0,"selectionRoot":306},{"event":5,"map":5,"piece":1,"selectionRoot":306},{"event":5,"map":5,"piece":2,"selectionRoot":306},{"event":5,"map":5,"piece":3,"selectionRoot":306},{"event":6,"map":6,"piece":0,"selectionRoot":307},{"event":6,"map":6,"piece":1,"selectionRoot":307},{"event":6,"map":6,"piece":2,"selectionRoot":307},{"event":6,"map":6,"piece":3,"selectionRoot":307},{"event":7,"map":7,"piece":0,"selectionRoot":308},{"event":7,"map":7,"piece":1,"selectionRoot":308},{"event":7,"map":7,"piece":2,"selectionRoot":308},{"event":7,"map":7,"piece":3,"selectionRoot":308},{"event":8,"map":8,"piece":0,"selectionRoot":309},{"event":8,"map":8,"piece":1,"selectionRoot":309},{"event":8,"map":8,"piece":2,"selectionRoot":309},{"event":8,"map":8,"piece":3,"selectionRoot":309},{"event":9,"map":9,"piece":0,"selectionRoot":310},{"event":9,"map":9,"piece":1,"selectionRoot":310},{"event":9,"map":9,"piece":2,"selectionRoot":310},{"event":9,"map":9,"piece":3,"selectionRoot":310},{"event":10,"map":10,"piece":0,"selectionRoot":311},{"event":10,"map":10,"piece":1,"selectionRoot":311},{"event":10,"map":10,"piece":2,"selectionRoot":311},{"event":10,"map":10,"piece":3,"selectionRoot":311},{"event":11,"map":11,"piece":0,"selectionRoot":312},{"event":11,"map":11,"piece":1,"selectionRoot":312},{"event":11,"map":11,"piece":2,"selectionRoot":312},{"event":11,"map":11,"piece":3,"selectionRoot":312},{"event":12,"map":12,"piece":0,"selectionRoot":313},{"event":12,"map":12,"piece":1,"selectionRoot":313},{"event":12,"map":12,"piece":2,"selectionRoot":313},{"event":12,"map":12,"piece":3,"selectionRoot":313},{"event":13,"map":13,"piece":0,"selectionRoot":314},{"event":13,"map":13,"piece":1,"selectionRoot":314},{"event":13,"map":13,"piece":2,"selectionRoot":314},{"event":13,"map":13,"piece":3,"selectionRoot":314},{"event":14,"map":14,"piece":0,"selectionRoot":315},{"event":14,"map":14,"piece":1,"selectionRoot":315},{"event":14,"map":14,"piece":2,"selectionRoot":315},{"event":14,"map":14,"piece":3,"selectionRoot":315},{"event":15,"map":15,"piece":0,"selectionRoot":316},{"event":15,"map":15,"piece":1,"selectionRoot":316},{"event":15,"map":15,"piece":2,"selectionRoot":316},{"event":15,"map":15,"piece":3,"selectionRoot":316},{"event":16,"map":16,"piece":0,"selectionRoot":317},{"event":16,"map":16,"piece":1,"selectionRoot":317},{"event":16,"map":16,"piece":2,"selectionRoot":317},{"event":16,"map":16,"piece":3,"selectionRoot":317},{"event":17,"map":17,"piece":0,"selectionRoot":318},{"event":17,"map":17,"piece":1,"selectionRoot":318},{"event":17,"map":17,"piece":2,"selectionRoot":318},{"event":17,"map":17,"piece":3,"selectionRoot":318},{"event":18,"map":18,"piece":0,"selectionRoot":319},{"event":18,"map":18,"piece":1,"selectionRoot":319},{"event":18,"map":18,"piece":2,"selectionRoot":319},{"event":18,"map":18,"piece":3,"selectionRoot":319},{"event":19,"map":19,"piece":0,"selectionRoot":320},{"event":19,"map":19,"piece":1,"selectionRoot":320},{"event":19,"map":19,"piece":2,"selectionRoot":320},{"event":19,"map":19,"piece":3,"selectionRoot":320},{"event":0,"map":20,"piece":4,"selectionRoot":321},{"event":0,"map":20,"piece":5,"selectionRoot":321},{"event":0,"map":20,"piece":6,"selectionRoot":321},{"event":0,"map":20,"piece":7,"selectionRoot":321},{"event":0,"map":20,"piece":8,"selectionRoot":321},{"event":0,"map":20,"piece":9,"selectionRoot":321},{"event":0,"map":20,"piece":10,"selectionRoot":321},{"event":0,"map":20,"piece":11,"selectionRoot":321},{"event":0,"map":20,"piece":12,"selectionRoot":321},{"event":0,"map":20,"piece":13,"selectionRoot":321},{"event":0,"map":20,"piece":14,"selectionRoot":321},{"event":0,"map":20,"piece":15,"selectionRoot":321},{"event":1,"map":21,"piece":4,"selectionRoot":322},{"event":1,"map":21,"piece":5,"selectionRoot":322},{"event":1,"map":21,"piece":6,"selectionRoot":322},{"event":1,"map":21,"piece":7,"selectionRoot":322},{"event":1,"map":21,"piece":8,"selectionRoot":322},{"event":1,"map":21,"piece":9,"selectionRoot":322},{"event":1,"map":21,"piece":10,"selectionRoot":322},{"event":1,"map":21,"piece":11,"selectionRoot":322},{"event":1,"map":21,"piece":12,"selectionRoot":322},{"event":1,"map":21,"piece":13,"selectionRoot":322},{"event":1,"map":21,"piece":14,"selectionRoot":322},{"event":1,"map":21,"piece":15,"selectionRoot":322},{"event":2,"map":22,"piece":4,"selectionRoot":323},{"event":2,"map":22,"piece":5,"selectionRoot":323},{"event":2,"map":22,"piece":6,"selectionRoot